[
  {
    "participant_id": "P_FX",
    "trial_id": "T99",
    "fixation_id": "fix_000",
    "t_start_ms": 0.0,
    "duration_ms": 150,
    "segment_id": "seg_q1",
    "empty_space_category": null,
    "panel_label": "question",
    "assignment_confidence": 1.0,
    "scroll": {
      "direction": "none",
      "displacement_px": 0.0,
      "velocity_px_s": 0.0,
      "t_since_scroll_onset_ms": 0,
      "t_since_scroll_offset_ms": 0,
      "during_scroll": false,
      "viewport_doc_position": 0.0,
      "gaze_viewport_y": 0.5
    },
    "prev_saccade": {
      "amplitude": 80.0,
      "direction_deg": 90.0
    },
    "ambiguous": false,
    "segment_id_alt": null,
    "star_condition": "not_eligible"
  },
  {
    "participant_id": "P_FX",
    "trial_id": "T99",
    "fixation_id": "fix_001",
    "t_start_ms": 180.0,
    "duration_ms": 160,
    "segment_id": "seg_q2",
    "empty_space_category": null,
    "panel_label": "question",
    "assignment_confidence": 1.0,
    "scroll": {
      "direction": "none",
      "displacement_px": 0.0,
      "velocity_px_s": 0.0,
      "t_since_scroll_onset_ms": 0,
      "t_since_scroll_offset_ms": 0,
      "during_scroll": false,
      "viewport_doc_position": 0.0,
      "gaze_viewport_y": 0.5
    },
    "prev_saccade": {
      "amplitude": 90.0,
      "direction_deg": -90.0
    },
    "ambiguous": false,
    "segment_id_alt": null,
    "star_condition": "not_eligible"
  },
  {
    "participant_id": "P_FX",
    "trial_id": "T99",
    "fixation_id": "fix_002",
    "t_start_ms": 360.0,
    "duration_ms": 170,
    "segment_id": "seg_r1",
    "empty_space_category": null,
    "panel_label": "response",
    "assignment_confidence": 1.0,
    "scroll": {
      "direction": "none",
      "displacement_px": 0.0,
      "velocity_px_s": 0.0,
      "t_since_scroll_onset_ms": 0,
      "t_since_scroll_offset_ms": 0,
      "during_scroll": false,
      "viewport_doc_position": 0.0,
      "gaze_viewport_y": 0.5
    },
    "prev_saccade": {
      "amplitude": 100.0,
      "direction_deg": 90.0
    },
    "ambiguous": false,
    "segment_id_alt": null,
    "star_condition": "not_eligible"
  },
  {
    "participant_id": "P_FX",
    "trial_id": "T99",
    "fixation_id": "fix_003",
    "t_start_ms": 540.0,
    "duration_ms": 180,
    "segment_id": "seg_r2",
    "empty_space_category": null,
    "panel_label": "response",
    "assignment_confidence": 0.95,
    "scroll": {
      "direction": "none",
      "displacement_px": 0.0,
      "velocity_px_s": 0.0,
      "t_since_scroll_onset_ms": 0,
      "t_since_scroll_offset_ms": 0,
      "during_scroll": false,
      "viewport_doc_position": 0.0,
      "gaze_viewport_y": 0.5
    },
    "prev_saccade": {
      "amplitude": 110.0,
      "direction_deg": -90.0
    },
    "ambiguous": false,
    "segment_id_alt": null,
    "star_condition": "not_eligible"
  },
  {
    "participant_id": "P_FX",
    "trial_id": "T99",
    "fixation_id": "fix_004",
    "t_start_ms": 720.0,
    "duration_ms": 190,
    "segment_id": "seg_ms1",
    "empty_space_category": null,
    "panel_label": "mark_scheme",
    "assignment_confidence": 1.0,
    "scroll": {
      "direction": "none",
      "displacement_px": 0.0,
      "velocity_px_s": 0.0,
      "t_since_scroll_onset_ms": 0,
      "t_since_scroll_offset_ms": 0,
      "during_scroll": false,
      "viewport_doc_position": 0.0,
      "gaze_viewport_y": 0.5
    },
    "prev_saccade": {
      "amplitude": 120.0,
      "direction_deg": 90.0
    },
    "ambiguous": false,
    "segment_id_alt": null,
    "star_condition": "not_eligible"
  },
  {
    "participant_id": "P_FX",
    "trial_id": "T99",
    "fixation_id": "fix_005",
    "t_start_ms": 900.0,
    "duration_ms": 200,
    "segment_id": "seg_r2",
    "empty_space_category": null,
    "panel_label": "response",
    "assignment_confidence": 0.9,
    "scroll": {
      "direction": "none",
      "displacement_px": 0.0,
      "velocity_px_s": 0.0,
      "t_since_scroll_onset_ms": 0,
      "t_since_scroll_offset_ms": 0,
      "during_scroll": false,
      "viewport_doc_position": 0.0,
      "gaze_viewport_y": 0.5
    },
    "prev_saccade": {
      "amplitude": 80.0,
      "direction_deg": -90.0
    },
    "ambiguous": false,
    "segment_id_alt": null,
    "star_condition": "not_eligible"
  },
  {
    "participant_id": "P_FX",
    "trial_id": "T99",
    "fixation_id": "fix_006",
    "t_start_ms": 1080.0,
    "duration_ms": 210,
    "segment_id": "seg_ms2",
    "empty_space_category": null,
    "panel_label": "mark_scheme",
    "assignment_confidence": 1.0,
    "scroll": {
      "direction": "none",
      "displacement_px": 0.0,
      "velocity_px_s": 0.0,
      "t_since_scroll_onset_ms": 0,
      "t_since_scroll_offset_ms": 0,
      "during_scroll": false,
      "viewport_doc_position": 0.0,
      "gaze_viewport_y": 0.5
    },
    "prev_saccade": {
      "amplitude": 90.0,
      "direction_deg": 90.0
    },
    "ambiguous": false,
    "segment_id_alt": null,
    "star_condition": "not_eligible"
  },
  {
    "participant_id": "P_FX",
    "trial_id": "T99",
    "fixation_id": "fix_007",
    "t_start_ms": 1260.0,
    "duration_ms": 120,
    "segment_id": null,
    "empty_space_category": "response_background",
    "panel_label": "response",
    "assignment_confidence": 0.0,
    "scroll": {
      "direction": "none",
      "displacement_px": 0.0,
      "velocity_px_s": 0.0,
      "t_since_scroll_onset_ms": 0,
      "t_since_scroll_offset_ms": 0,
      "during_scroll": false,
      "viewport_doc_position": 0.0,
      "gaze_viewport_y": 0.5
    },
    "prev_saccade": {
      "amplitude": 0.0,
      "direction_deg": 0.0
    },
    "ambiguous": false,
    "segment_id_alt": null,
    "star_condition": "not_eligible"
  },
  {
    "participant_id": "P_FX",
    "trial_id": "T99",
    "fixation_id": "fix_008",
    "t_start_ms": 1440.0,
    "duration_ms": 160,
    "segment_id": "seg_ld1",
    "empty_space_category": null,
    "panel_label": "mark_scheme",
    "assignment_confidence": 0.85,
    "scroll": {
      "direction": "none",
      "displacement_px": 0.0,
      "velocity_px_s": 0.0,
      "t_since_scroll_onset_ms": 0,
      "t_since_scroll_offset_ms": 0,
      "during_scroll": false,
      "viewport_doc_position": 0.0,
      "gaze_viewport_y": 0.5
    },
    "prev_saccade": {
      "amplitude": 110.0,
      "direction_deg": 90.0
    },
    "ambiguous": false,
    "segment_id_alt": null,
    "star_condition": "not_eligible"
  },
  {
    "participant_id": "P_FX",
    "trial_id": "T99",
    "fixation_id": "fix_009",
    "t_start_ms": 1620.0,
    "duration_ms": 170,
    "segment_id": "seg_c1",
    "empty_space_category": null,
    "panel_label": "commentary",
    "assignment_confidence": 1.0,
    "scroll": {
      "direction": "none",
      "displacement_px": 0.0,
      "velocity_px_s": 0.0,
      "t_since_scroll_onset_ms": 0,
      "t_since_scroll_offset_ms": 0,
      "during_scroll": false,
      "viewport_doc_position": 0.0,
      "gaze_viewport_y": 0.5
    },
    "prev_saccade": {
      "amplitude": 120.0,
      "direction_deg": -90.0
    },
    "ambiguous": false,
    "segment_id_alt": null,
    "star_condition": "not_eligible"
  },
  {
    "participant_id": "P_FX",
    "trial_id": "T99",
    "fixation_id": "fix_010",
    "t_start_ms": 1800.0,
    "duration_ms": 180,
    "segment_id": "seg_r1",
    "empty_space_category": null,
    "panel_label": "response",
    "assignment_confidence": 0.9,
    "scroll": {
      "direction": "down",
      "displacement_px": 12.0,
      "velocity_px_s": 40.0,
      "t_since_scroll_onset_ms": 0,
      "t_since_scroll_offset_ms": 0,
      "during_scroll": true,
      "viewport_doc_position": 0.2,
      "gaze_viewport_y": 0.4
    },
    "prev_saccade": {
      "amplitude": 80.0,
      "direction_deg": 90.0
    },
    "ambiguous": false,
    "segment_id_alt": null,
    "star_condition": "not_eligible"
  },
  {
    "participant_id": "P_FX",
    "trial_id": "T99",
    "fixation_id": "fix_011",
    "t_start_ms": 1980.0,
    "duration_ms": 190,
    "segment_id": "seg_c2",
    "empty_space_category": null,
    "panel_label": "commentary",
    "assignment_confidence": 1.0,
    "scroll": {
      "direction": "none",
      "displacement_px": 0.0,
      "velocity_px_s": 0.0,
      "t_since_scroll_onset_ms": 0,
      "t_since_scroll_offset_ms": 0,
      "during_scroll": false,
      "viewport_doc_position": 0.0,
      "gaze_viewport_y": 0.5
    },
    "prev_saccade": {
      "amplitude": 90.0,
      "direction_deg": -90.0
    },
    "ambiguous": false,
    "segment_id_alt": null,
    "star_condition": "not_eligible"
  },
  {
    "participant_id": "P_FX",
    "trial_id": "T99",
    "fixation_id": "fix_012",
    "t_start_ms": 2160.0,
    "duration_ms": 200,
    "segment_id": "seg_ms1",
    "empty_space_category": null,
    "panel_label": "mark_scheme",
    "assignment_confidence": 1.0,
    "scroll": {
      "direction": "none",
      "displacement_px": 0.0,
      "velocity_px_s": 0.0,
      "t_since_scroll_onset_ms": 0,
      "t_since_scroll_offset_ms": 0,
      "during_scroll": false,
      "viewport_doc_position": 0.0,
      "gaze_viewport_y": 0.5
    },
    "prev_saccade": {
      "amplitude": 100.0,
      "direction_deg": 90.0
    },
    "ambiguous": false,
    "segment_id_alt": null,
    "star_condition": "not_eligible"
  },
  {
    "participant_id": "P_FX",
    "trial_id": "T99",
    "fixation_id": "fix_013",
    "t_start_ms": 2340.0,
    "duration_ms": 210,
    "segment_id": "seg_r2",
    "empty_space_category": null,
    "panel_label": "response",
    "assignment_confidence": 1.0,
    "scroll": {
      "direction": "none",
      "displacement_px": 0.0,
      "velocity_px_s": 0.0,
      "t_since_scroll_onset_ms": 0,
      "t_since_scroll_offset_ms": 0,
      "during_scroll": false,
      "viewport_doc_position": 0.0,
      "gaze_viewport_y": 0.5
    },
    "prev_saccade": {
      "amplitude": 110.0,
      "direction_deg": -90.0
    },
    "ambiguous": false,